<?xml version="1.0" encoding="UTF-8"?>
<dataroot xmlns:od="urn:schemas-microsoft-com:officedata" xmlns:xsi="http://www.w3.org/2001/XMLSchema-instance"  xsi:noNamespaceSchemaLocation="tbl-Product_service_link.xsd" generated="2010-06-25T11:54:58">
<tbl-Product_service_link>
<RODDID>5</RODDID>
<serviceID>41</serviceID>
</tbl-Product_service_link>
<tbl-Product_service_link>
<RODDID>6</RODDID>
<serviceID>61</serviceID>
</tbl-Product_service_link>
<tbl-Product_service_link>
<RODDID>8</RODDID>
<serviceID>43</serviceID>
</tbl-Product_service_link>
<tbl-Product_service_link>
<RODDID>9</RODDID>
<serviceID>43</serviceID>
</tbl-Product_service_link>
<tbl-Product_service_link>
<RODDID>11</RODDID>
<serviceID>33</serviceID>
</tbl-Product_service_link>
<tbl-Product_service_link>
<RODDID>12</RODDID>
<serviceID>33</serviceID>
</tbl-Product_service_link>
<tbl-Product_service_link>
<RODDID>13</RODDID>
<serviceID>44</serviceID>
</tbl-Product_service_link>
<tbl-Product_service_link>
<RODDID>14</RODDID>
<serviceID>44</serviceID>
</tbl-Product_service_link>
<tbl-Product_service_link>
<RODDID>15</RODDID>
<serviceID>816</serviceID>
</tbl-Product_service_link>
<tbl-Product_service_link>
<RODDID>16</RODDID>
<serviceID>816</serviceID>
</tbl-Product_service_link>
<tbl-Product_service_link>
<RODDID>17</RODDID>
<serviceID>45</serviceID>
</tbl-Product_service_link>
<tbl-Product_service_link>
<RODDID>18</RODDID>
<serviceID>62</serviceID>
</tbl-Product_service_link>
<tbl-Product_service_link>
<RODDID>19</RODDID>
<serviceID>32</serviceID>
</tbl-Product_service_link>
<tbl-Product_service_link>
<RODDID>22</RODDID>
<serviceID>47</serviceID>
</tbl-Product_service_link>
<tbl-Product_service_link>
<RODDID>23</RODDID>
<serviceID>63</serviceID>
</tbl-Product_service_link>
<tbl-Product_service_link>
<RODDID>24</RODDID>
<serviceID>35</serviceID>
</tbl-Product_service_link>
<tbl-Product_service_link>
<RODDID>28</RODDID>
<serviceID>137</serviceID>
</tbl-Product_service_link>
<tbl-Product_service_link>
<RODDID>29</RODDID>
<serviceID>137</serviceID>
</tbl-Product_service_link>
<tbl-Product_service_link>
<RODDID>31</RODDID>
<serviceID>825</serviceID>
</tbl-Product_service_link>
<tbl-Product_service_link>
<RODDID>32</RODDID>
<serviceID>137</serviceID>
</tbl-Product_service_link>
<tbl-Product_service_link>
<RODDID>37</RODDID>
<serviceID>816</serviceID>
</tbl-Product_service_link>
<tbl-Product_service_link>
<RODDID>40</RODDID>
<serviceID>816</serviceID>
</tbl-Product_service_link>
<tbl-Product_service_link>
<RODDID>41</RODDID>
<serviceID>816</serviceID>
</tbl-Product_service_link>
<tbl-Product_service_link>
<RODDID>42</RODDID>
<serviceID>816</serviceID>
</tbl-Product_service_link>
<tbl-Product_service_link>
<RODDID>43</RODDID>
<serviceID>141</serviceID>
</tbl-Product_service_link>
<tbl-Product_service_link>
<RODDID>45</RODDID>
<serviceID>827</serviceID>
</tbl-Product_service_link>
<tbl-Product_service_link>
<RODDID>46</RODDID>
<serviceID>825</serviceID>
</tbl-Product_service_link>
<tbl-Product_service_link>
<RODDID>47</RODDID>
<serviceID>71</serviceID>
</tbl-Product_service_link>
<tbl-Product_service_link>
<RODDID>58</RODDID>
<serviceID>137</serviceID>
</tbl-Product_service_link>
<tbl-Product_service_link>
<RODDID>59</RODDID>
<serviceID>138</serviceID>
</tbl-Product_service_link>
<tbl-Product_service_link>
<RODDID>65</RODDID>
<serviceID>141</serviceID>
</tbl-Product_service_link>
<tbl-Product_service_link>
<RODDID>66</RODDID>
<serviceID>141</serviceID>
</tbl-Product_service_link>
<tbl-Product_service_link>
<RODDID>67</RODDID>
<serviceID>71</serviceID>
</tbl-Product_service_link>
<tbl-Product_service_link>
<RODDID>68</RODDID>
<serviceID>137</serviceID>
</tbl-Product_service_link>
<tbl-Product_service_link>
<RODDID>73</RODDID>
<serviceID>141</serviceID>
</tbl-Product_service_link>
<tbl-Product_service_link>
<RODDID>84</RODDID>
</tbl-Product_service_link>
<tbl-Product_service_link>
<RODDID>85</RODDID>
<serviceID>132</serviceID>
</tbl-Product_service_link>
<tbl-Product_service_link>
<RODDID>87</RODDID>
<serviceID>141</serviceID>
</tbl-Product_service_link>
<tbl-Product_service_link>
<RODDID>88</RODDID>
<serviceID>804</serviceID>
</tbl-Product_service_link>
<tbl-Product_service_link>
<RODDID>89</RODDID>
<serviceID>795</serviceID>
</tbl-Product_service_link>
<tbl-Product_service_link>
<RODDID>90</RODDID>
<serviceID>825</serviceID>
</tbl-Product_service_link>
<tbl-Product_service_link>
<RODDID>103</RODDID>
<serviceID>36</serviceID>
</tbl-Product_service_link>
<tbl-Product_service_link>
<RODDID>104</RODDID>
</tbl-Product_service_link>
<tbl-Product_service_link>
<RODDID>109</RODDID>
<serviceID>795</serviceID>
</tbl-Product_service_link>
<tbl-Product_service_link>
<RODDID>115</RODDID>
<serviceID>17</serviceID>
</tbl-Product_service_link>
<tbl-Product_service_link>
<RODDID>116</RODDID>
<serviceID>17</serviceID>
</tbl-Product_service_link>
<tbl-Product_service_link>
<RODDID>119</RODDID>
<serviceID>804</serviceID>
</tbl-Product_service_link>
<tbl-Product_service_link>
<RODDID>121</RODDID>
<serviceID>17</serviceID>
</tbl-Product_service_link>
<tbl-Product_service_link>
<RODDID>122</RODDID>
<serviceID>804</serviceID>
</tbl-Product_service_link>
<tbl-Product_service_link>
<RODDID>124</RODDID>
<serviceID>825</serviceID>
</tbl-Product_service_link>
<tbl-Product_service_link>
<RODDID>125</RODDID>
<serviceID>799</serviceID>
</tbl-Product_service_link>
<tbl-Product_service_link>
<RODDID>127</RODDID>
<serviceID>134</serviceID>
</tbl-Product_service_link>
<tbl-Product_service_link>
<RODDID>128</RODDID>
<serviceID>135</serviceID>
</tbl-Product_service_link>
<tbl-Product_service_link>
<RODDID>135</RODDID>
<serviceID>134</serviceID>
</tbl-Product_service_link>
<tbl-Product_service_link>
<RODDID>136</RODDID>
<serviceID>135</serviceID>
</tbl-Product_service_link>
<tbl-Product_service_link>
<RODDID>139</RODDID>
<serviceID>49</serviceID>
</tbl-Product_service_link>
<tbl-Product_service_link>
<RODDID>141</RODDID>
<serviceID>51</serviceID>
</tbl-Product_service_link>
<tbl-Product_service_link>
<RODDID>150</RODDID>
<serviceID>53</serviceID>
</tbl-Product_service_link>
<tbl-Product_service_link>
<RODDID>151</RODDID>
<serviceID>66</serviceID>
</tbl-Product_service_link>
<tbl-Product_service_link>
<RODDID>152</RODDID>
<serviceID>816</serviceID>
</tbl-Product_service_link>
<tbl-Product_service_link>
<RODDID>164</RODDID>
<serviceID>71</serviceID>
</tbl-Product_service_link>
<tbl-Product_service_link>
<RODDID>166</RODDID>
<serviceID>55</serviceID>
</tbl-Product_service_link>
<tbl-Product_service_link>
<RODDID>167</RODDID>
<serviceID>57</serviceID>
</tbl-Product_service_link>
<tbl-Product_service_link>
<RODDID>168</RODDID>
<serviceID>57</serviceID>
</tbl-Product_service_link>
<tbl-Product_service_link>
<RODDID>169</RODDID>
<serviceID>56</serviceID>
</tbl-Product_service_link>
<tbl-Product_service_link>
<RODDID>171</RODDID>
<serviceID>57</serviceID>
</tbl-Product_service_link>
<tbl-Product_service_link>
<RODDID>172</RODDID>
<serviceID>57</serviceID>
</tbl-Product_service_link>
<tbl-Product_service_link>
<RODDID>174</RODDID>
<serviceID>93</serviceID>
</tbl-Product_service_link>
<tbl-Product_service_link>
<RODDID>175</RODDID>
<serviceID>92</serviceID>
</tbl-Product_service_link>
<tbl-Product_service_link>
<RODDID>180</RODDID>
<serviceID>92</serviceID>
</tbl-Product_service_link>
<tbl-Product_service_link>
<RODDID>181</RODDID>
<serviceID>92</serviceID>
</tbl-Product_service_link>
<tbl-Product_service_link>
<RODDID>182</RODDID>
<serviceID>92</serviceID>
</tbl-Product_service_link>
<tbl-Product_service_link>
<RODDID>184</RODDID>
<serviceID>804</serviceID>
</tbl-Product_service_link>
<tbl-Product_service_link>
<RODDID>187</RODDID>
<serviceID>825</serviceID>
</tbl-Product_service_link>
<tbl-Product_service_link>
<RODDID>188</RODDID>
<serviceID>804</serviceID>
</tbl-Product_service_link>
<tbl-Product_service_link>
<RODDID>189</RODDID>
<serviceID>17</serviceID>
</tbl-Product_service_link>
<tbl-Product_service_link>
<RODDID>191</RODDID>
<serviceID>16</serviceID>
</tbl-Product_service_link>
<tbl-Product_service_link>
<RODDID>193</RODDID>
<serviceID>59</serviceID>
</tbl-Product_service_link>
<tbl-Product_service_link>
<RODDID>194</RODDID>
<serviceID>67</serviceID>
</tbl-Product_service_link>
<tbl-Product_service_link>
<RODDID>195</RODDID>
<serviceID>72</serviceID>
</tbl-Product_service_link>
<tbl-Product_service_link>
<RODDID>196</RODDID>
<serviceID>85</serviceID>
</tbl-Product_service_link>
<tbl-Product_service_link>
<RODDID>197</RODDID>
<serviceID>156</serviceID>
</tbl-Product_service_link>
<tbl-Product_service_link>
<RODDID>198</RODDID>
<serviceID>107</serviceID>
</tbl-Product_service_link>
<tbl-Product_service_link>
<RODDID>200</RODDID>
<serviceID>134</serviceID>
</tbl-Product_service_link>
<tbl-Product_service_link>
<RODDID>201</RODDID>
<serviceID>135</serviceID>
</tbl-Product_service_link>
<tbl-Product_service_link>
<RODDID>202</RODDID>
<serviceID>70</serviceID>
</tbl-Product_service_link>
<tbl-Product_service_link>
<RODDID>203</RODDID>
<serviceID>16</serviceID>
</tbl-Product_service_link>
<tbl-Product_service_link>
<RODDID>204</RODDID>
<serviceID>816</serviceID>
</tbl-Product_service_link>
<tbl-Product_service_link>
<RODDID>205</RODDID>
<serviceID>816</serviceID>
</tbl-Product_service_link>
<tbl-Product_service_link>
<RODDID>206</RODDID>
<serviceID>105</serviceID>
</tbl-Product_service_link>
<tbl-Product_service_link>
<RODDID>207</RODDID>
<serviceID>100</serviceID>
</tbl-Product_service_link>
<tbl-Product_service_link>
<RODDID>208</RODDID>
<serviceID>106</serviceID>
</tbl-Product_service_link>
<tbl-Product_service_link>
<RODDID>211</RODDID>